{
  "schema_version": "1.0",
  "model": "fake-asr",
  "language": "vi",
  "segments": [
    {
      "start_sec": 0.5,
      "end_sec": 5.8,
      "text": "Chào mọi người, hôm nay mình chốt phạm vi sprint 42 nhé.",
      "avg_logprob": -0.25,
      "no_speech_prob": 0.02,
      "compression_ratio": 1.3,
      "words": [
        {
          "w": "Chào",
          "s": 0.5,
          "e": 0.942,
          "p": 0.91
        },
        {
          "w": "mọi",
          "s": 0.942,
          "e": 1.383,
          "p": 0.91
        },
        {
          "w": "người,",
          "s": 1.383,
          "e": 1.825,
          "p": 0.91
        },
        {
          "w": "hôm",
          "s": 1.825,
          "e": 2.267,
          "p": 0.91
        },
        {
          "w": "nay",
          "s": 2.267,
          "e": 2.708,
          "p": 0.91
        },
        {
          "w": "mình",
          "s": 2.708,
          "e": 3.15,
          "p": 0.91
        },
        {
          "w": "chốt",
          "s": 3.15,
          "e": 3.592,
          "p": 0.91
        },
        {
          "w": "phạm",
          "s": 3.592,
          "e": 4.033,
          "p": 0.91
        },
        {
          "w": "vi",
          "s": 4.033,
          "e": 4.475,
          "p": 0.91
        },
        {
          "w": "sprint",
          "s": 4.475,
          "e": 4.917,
          "p": 0.91
        },
        {
          "w": "42",
          "s": 4.917,
          "e": 5.358,
          "p": 0.91
        },
        {
          "w": "nhé.",
          "s": 5.358,
          "e": 5.8,
          "p": 0.91
        }
      ]
    },
    {
      "start_sec": 6.0,
      "end_sec": 11.2,
      "text": "Em đề xuất làm xong API upload trước, có chống tạo trùng khi retry.",
      "avg_logprob": -0.25,
      "no_speech_prob": 0.02,
      "compression_ratio": 1.3,
      "words": [
        {
          "w": "Em",
          "s": 6.0,
          "e": 6.371,
          "p": 0.86
        },
        {
          "w": "đề",
          "s": 6.371,
          "e": 6.743,
          "p": 0.86
        },
        {
          "w": "xuất",
          "s": 6.743,
          "e": 7.114,
          "p": 0.86
        },
        {
          "w": "làm",
          "s": 7.114,
          "e": 7.486,
          "p": 0.86
        },
        {
          "w": "xong",
          "s": 7.486,
          "e": 7.857,
          "p": 0.86
        },
        {
          "w": "API",
          "s": 7.857,
          "e": 8.229,
          "p": 0.86
        },
        {
          "w": "upload",
          "s": 8.229,
          "e": 8.6,
          "p": 0.86
        },
        {
          "w": "trước,",
          "s": 8.6,
          "e": 8.971,
          "p": 0.86
        },
        {
          "w": "có",
          "s": 8.971,
          "e": 9.343,
          "p": 0.86
        },
        {
          "w": "chống",
          "s": 9.343,
          "e": 9.714,
          "p": 0.86
        },
        {
          "w": "tạo",
          "s": 9.714,
          "e": 10.086,
          "p": 0.86
        },
        {
          "w": "trùng",
          "s": 10.086,
          "e": 10.457,
          "p": 0.86
        },
        {
          "w": "khi",
          "s": 10.457,
          "e": 10.829,
          "p": 0.86
        },
        {
          "w": "retry.",
          "s": 10.829,
          "e": 11.2,
          "p": 0.86
        }
      ]
    },
    {
      "start_sec": 11.4,
      "end_sec": 16.9,
      "text": "Đồng ý. Anh Minh phụ trách phần upload, hạn thứ Sáu tuần này.",
      "avg_logprob": -0.25,
      "no_speech_prob": 0.02,
      "compression_ratio": 1.3,
      "words": [
        {
          "w": "Đồng",
          "s": 11.4,
          "e": 11.823,
          "p": 0.88
        },
        {
          "w": "ý.",
          "s": 11.823,
          "e": 12.246,
          "p": 0.88
        },
        {
          "w": "Anh",
          "s": 12.246,
          "e": 12.669,
          "p": 0.88
        },
        {
          "w": "Minh",
          "s": 12.669,
          "e": 13.092,
          "p": 0.88
        },
        {
          "w": "phụ",
          "s": 13.092,
          "e": 13.515,
          "p": 0.88
        },
        {
          "w": "trách",
          "s": 13.515,
          "e": 13.938,
          "p": 0.88
        },
        {
          "w": "phần",
          "s": 13.938,
          "e": 14.362,
          "p": 0.88
        },
        {
          "w": "upload,",
          "s": 14.362,
          "e": 14.785,
          "p": 0.88
        },
        {
          "w": "hạn",
          "s": 14.785,
          "e": 15.208,
          "p": 0.88
        },
        {
          "w": "thứ",
          "s": 15.208,
          "e": 15.631,
          "p": 0.88
        },
        {
          "w": "Sáu",
          "s": 15.631,
          "e": 16.054,
          "p": 0.88
        },
        {
          "w": "tuần",
          "s": 16.054,
          "e": 16.477,
          "p": 0.88
        },
        {
          "w": "này.",
          "s": 16.477,
          "e": 16.9,
          "p": 0.88
        }
      ]
    },
    {
      "start_sec": 17.0,
      "end_sec": 21.5,
      "text": "Còn export DOCX thì mình lùi sang sau MVP.",
      "avg_logprob": -0.25,
      "no_speech_prob": 0.02,
      "compression_ratio": 1.3,
      "words": [
        {
          "w": "Còn",
          "s": 17.0,
          "e": 17.5,
          "p": 0.84
        },
        {
          "w": "export",
          "s": 17.5,
          "e": 18.0,
          "p": 0.84
        },
        {
          "w": "DOCX",
          "s": 18.0,
          "e": 18.5,
          "p": 0.84
        },
        {
          "w": "thì",
          "s": 18.5,
          "e": 19.0,
          "p": 0.84
        },
        {
          "w": "mình",
          "s": 19.0,
          "e": 19.5,
          "p": 0.84
        },
        {
          "w": "lùi",
          "s": 19.5,
          "e": 20.0,
          "p": 0.84
        },
        {
          "w": "sang",
          "s": 20.0,
          "e": 20.5,
          "p": 0.84
        },
        {
          "w": "sau",
          "s": 20.5,
          "e": 21.0,
          "p": 0.84
        },
        {
          "w": "MVP.",
          "s": 21.0,
          "e": 21.5,
          "p": 0.84
        }
      ]
    },
    {
      "start_sec": 21.3,
      "end_sec": 22.4,
      "text": "Ừ, được.",
      "avg_logprob": -1.1,
      "no_speech_prob": 0.02,
      "compression_ratio": 1.3,
      "words": [
        {
          "w": "Ừ,",
          "s": 21.3,
          "e": 21.85,
          "p": 0.42
        },
        {
          "w": "được.",
          "s": 21.85,
          "e": 22.4,
          "p": 0.42
        }
      ]
    },
    {
      "start_sec": 23.0,
      "end_sec": 28.6,
      "text": "Vậy tuần này cần tìm thêm audio có tiếng ồn để đánh giá.",
      "avg_logprob": -0.25,
      "no_speech_prob": 0.02,
      "compression_ratio": 1.3,
      "words": [
        {
          "w": "Vậy",
          "s": 23.0,
          "e": 23.431,
          "p": 0.89
        },
        {
          "w": "tuần",
          "s": 23.431,
          "e": 23.862,
          "p": 0.89
        },
        {
          "w": "này",
          "s": 23.862,
          "e": 24.292,
          "p": 0.89
        },
        {
          "w": "cần",
          "s": 24.292,
          "e": 24.723,
          "p": 0.89
        },
        {
          "w": "tìm",
          "s": 24.723,
          "e": 25.154,
          "p": 0.89
        },
        {
          "w": "thêm",
          "s": 25.154,
          "e": 25.585,
          "p": 0.89
        },
        {
          "w": "audio",
          "s": 25.585,
          "e": 26.015,
          "p": 0.89
        },
        {
          "w": "có",
          "s": 26.015,
          "e": 26.446,
          "p": 0.89
        },
        {
          "w": "tiếng",
          "s": 26.446,
          "e": 26.877,
          "p": 0.89
        },
        {
          "w": "ồn",
          "s": 26.877,
          "e": 27.308,
          "p": 0.89
        },
        {
          "w": "để",
          "s": 27.308,
          "e": 27.738,
          "p": 0.89
        },
        {
          "w": "đánh",
          "s": 27.738,
          "e": 28.169,
          "p": 0.89
        },
        {
          "w": "giá.",
          "s": 28.169,
          "e": 28.6,
          "p": 0.89
        }
      ]
    }
  ],
  "warnings": []
}
